{
  "compatibility": {
    "macos_python_3_12": "PASS",
    "ubuntu_python_3_10": "PASS",
    "ubuntu_python_3_13": "PASS",
    "windows_python_3_12": "PASS"
  },
  "compatibility_scope": "Recorded compatibility results are a prior release baseline. CI-only gates for this source tree remain explicitly NOT_RUN or PARTIAL until an external attestation is created.",
  "evidence_date": "2026-10-22",
  "gates": {
    "bandit_high_severity": "NOT_RUN",
    "bounded_performance": "LOCAL_PREFLIGHT",
    "byte_identical_release_builds": "LOCAL_PREFLIGHT",
    "complete_regression": "PARTIAL",
    "coverage_line_and_branch": "LOCAL_PREFLIGHT",
    "critical_mutation_killed": "NOT_RUN",
    "dependency_vulnerability_audit": "NOT_RUN",
    "deterministic_sbom": "PASS",
    "deterministic_visual_reports": "PASS",
    "docs_build": "NOT_RUN",
    "execution_receipts": "LOCAL_PREFLIGHT",
    "json_schemas_19": "PASS",
    "mypy_strict": "NOT_RUN",
    "repository_and_contract_audit": "PASS",
    "reproducibility_capsule": "LOCAL_PREFLIGHT",
    "reverse_order_regression": "NOT_RUN",
    "ruff_format_and_lint": "NOT_RUN",
    "scientific_quality_guards": "PASS",
    "seeded_random_order_regression": "NOT_RUN",
    "validation_tree_digest": "PASS",
    "wheel_and_sdist_install": "NOT_RUN"
  },
  "interpretation": [
    "This checked-in record is intentionally PARTIAL and must not be interpreted as a completed CI run.",
    "The source-tree digest records the candidate content before external CI attestation.",
    "CI-only gates remain NOT_RUN or PARTIAL until GitHub Actions produces artifacts/VALIDATION_EVIDENCE.json and publication-attestation.json.",
    "Software checks do not grant scientific acceptance of external calculations or experiments."
  ],
  "limitations": [
    "Checked-in preflight evidence is not a substitute for the external CI attestation.",
    "External scientific execution requires a checksum-verifiable execution receipt."
  ],
  "provenance": {
    "commit_resolution": "pending-external-attestation",
    "dependency_lock_sha256": "20f37c16d727b7113513473d7767337a124cff835d86711148902a373f686f94",
    "digest_algorithm": "sha256(path\\0sha256(file)\\n)",
    "digest_exclusions": [
      ".coverage",
      ".coverage.*",
      "SHA256SUMS",
      "docs/QUALITY_HISTORY.json",
      "docs/VALIDATION_EVIDENCE.json",
      "docs/engineering-audit-report.pdf",
      "docs/test-dashboard.html",
      "docs/test-dashboard.svg"
    ],
    "evidence_generated_from_commit": null,
    "external_attestation": "NOT_AVAILABLE_UNTIL_CI_COMPLETES",
    "publication_parent_commit": null,
    "validated_file_count": 473,
    "validated_tree_sha256": "9b7721fc7ecc18908abe4ce575eb2b02c5f0dae3f74e33011e1dc6025ddfc11d",
    "workflow_job_id": null,
    "workflow_run_attempt": null,
    "workflow_run_id": null
  },
  "release": "0.7.4",
  "schema_version": "1.6",
  "status": "PARTIAL",
  "validation_scope": "preflight",
  "verified_inventory": {
    "capability_records": 341,
    "domain_packs": 7,
    "generic_domain_placeholders": 0,
    "runtime_core_capabilities": 19,
    "schemas": 20,
    "test_modules": 56,
    "workbook_named_capabilities": 322,
    "workflows": 15
  },
  "workflow": {
    "attempt": null,
    "name": "Local preflight and generated-artifact audit",
    "run_id": null,
    "source_commit_context": null
  }
}
